{
  "id": "nextprob.export-pdf",
  "name": "Export PDF",
  "description": "Saves notes as PDF documents.",
  "version": "1.0.0",
  "nextprob": ">=0.4.0 <1.0.0",
  "platforms": [
    "darwin-arm64",
    "darwin-x64",
    "linux-arm64",
    "linux-x64",
    "win32-arm64",
    "win32-x64"
  ],
  "main": "main.cjs",
  "dependencies": [
    "nextprob.export-engine"
  ],
  "dependencyVersions": {
    "nextprob.export-engine": ">=1.0.0 <2.0.0"
  },
  "ipc": {
    "handle": [
      "export:save-pdf"
    ],
    "on": [],
    "send": [
      "export:pdf-progress"
    ]
  },
  "renderer": "renderer.js",
  "apiVersion": 1
}
